QuestionType;Question;QuestionID;Answer
linearGrid;Mental Demand:  How mentally demanding was the task?;g7;6
linearGrid;Physical Demand:  How physically demanding was the task?;g8;2
linearGrid;Temporal Demand:  How hurried or rushed was the pace of the task?;g9;9
linearGrid;Performance:  How succesfull were you in accomplishing what you were asked to do?;g10;17
linearGrid;Effort:  How hard did you have to work to accomplish your level of performance?;g11;7
linearGrid;Frustration:  How insecure, discouraged, irritated, stressed, and annoyed were you?;g12;3

