QuestionType;Question;QuestionID;Answer
linearGrid;Mental Demand:  How mentally demanding was the task?;g13;1
linearGrid;Physical Demand:  How physically demanding was the task?;g14;1
linearGrid;Temporal Demand:  How hurried or rushed was the pace of the task?;g15;1
linearGrid;Performance:  How succesfull were you in accomplishing what you were asked to do?;g16;4
linearGrid;Effort:  How hard did you have to work to accomplish your level of performance?;g17;3
linearGrid;Frustration:  How insecure, discouraged, irritated, stressed, and annoyed were you?;g18;1

